"","cond","SID","value","article_number"
"686","social","s473","eating bananas helps a lot in carbohydrates",68
"687","self","s475","I am overweight this would help me",74
"688","self","s478","This article is about the risk of taking Statins to reduce cholesterol. It causes side effects of skin infections.",80
"689","social","s479","Vitamin d will help your tooth enamel while pregnant so the women in my life need to know this",60
"690","self","s481","My area may become more prone to forest fires even though I don't live in CA",17
"691","self","s482","This article matters to me because I know that kidney stones are extremely painful, and I want to do everything possible not to get them.  I also don't drink enough fluids, so this is a good reminder for me.",46
"692","self","s483","There is a recent trend of campaign ads addressing climate change.",95
"693","social","s485","Recycling may not be happening the way you think.",49
"694","self","s487","Article is about breast cancer risk",52
"695","social","s488","eating flavonoid-rich foods lowers your risk for cancer and other diseases",22
"696","self","s490","I am interested in quick workout routines",48
"697","social","s492","Dietary supplements may not be good for people like they think they are, in fact certain supplements can actually be deadly.",10
"698","self","s493","If the funds were spent right, it could help people during disasters, with hurricane . Government aid",13
"699","social","s494","This assumption is very benefit to break the trouble.....very happy",92
"700","social","s495","This article states that our choice to eat or not before working out has major implications on how we would see food for the rest of the day",0
"701","self","s496","good one to be renewed in that field",29
"702","social","s497","This article is about supplements for people with metabolic disorders.",74
"703","social","s498","Staph infections could be fairly treacherous right now, as any attempts to visit an urgent care can put you at risk for COVID.  Might be better to weigh whether or not you should be taking statins, at least until it's a little safer to deal with the increased risk.",80
"704","self","s499","it is good to see victory of coal mine in Australia and got a permit",21
"705","social","s502","About wildfires and how they destroy and consume natural areas.",7
"706","self","s504","This article matters to me because I am trying really hard to reduce the waste that my households creates. I care about the planet and I want to do my part in helping reduce pollution. I would love to know more ways to reduce my plastics.",55
"707","social","s505","the article able to create awareness about environmental issues.",43
"708","social","s506","Some people I know don't understand the difference between the Flu and Covid and how our immune system works at all. Many think just because they're young, they will be fine no matter what.",100
"709","self","s507","this doesnt make any sense to me.",76
"710","self","s512","Which bags are better",57
"711","social","s513","I suppose I know people who may be planning to buy a new vehicle and this would encourage them to seriously consider buying electric which would help the environment",73
"712","self","s514","As a sleepy mom I appreciate this info.",44
"713","self","s515","Natural resource cannot be found scarce in our environment.",67
"714","social","s516","article about eating disorder",96
"715","social","s517","The Article is about diabetes",4
"716","self","s520","This article is about climate change related costs on company's bottom line in the next 5 years, which equates to about $1 trillion.",87
"717","self","s522","Who wants to bother with recycling if it's really not happening? Also, what is the point of recycling if they are shipping the items to another country for processing? Carbon ...?",49
"718","self","s526","Eating fish could make your children smarter.",30
"719","self","s527","Having a dog sleep with you is beneficial for both to sleep better",38
"720","social","s529","This is an interview with Sylvia Earle, oceanographer.",71
"721","self","s530","excess weight leads to cancer",54
"722","social","s531","We all prefer and use plastic bags.",57
"723","self","s532","I think walking is really good for a persons health and would benefit anyone.",36
"724","social","s533","the journey of well know environmental activist Greta Thunberg",65
"725","self","s535","This article is relevant to me because I'm very aware of my health and susceptibility to sickness due to the pandemic.",100
"726","self","s537","The governments plan on discussions on how to address climate change.",31
"727","self","s538","There is a risk for those taking cholesterol-lowering medicine to develop skin infections.",80
"728","social","s540","This article is about how climate change is causing more dangerous rains.",15
"729","social","s541","Express weight training is great if you don't have much time.",48
"730","self","s543","The effect on surgar and our health.",32
"731","self","s544","Climate is everyone's personal and me also",109
"732","social","s545","Solar power is gaining traction, but still has a long way to go over fossil fuels.",93
"733","social","s546","How to add exercises and how the exercises help your body.",56
"734","social","s547","This article matters to people who want to help make a difference when it comes to slowing climate change.",31
"735","social","s548","Peoples are must know the increased risk of developing parkinson's disease.",82
"736","social","s551","i think this medicine need to be more studied",80
"737","social","s552","I know lots of people who have had some form of cancer. I'm always telling people about the food they eat and how it affects them adversely.",22
"738","social","s553","Science is rethinking how a workout  prior to breakfast will affect weight.",0
"739","social","s554","It is about the dozens of plastics which is being dumped in landfills,where the plastics can't get buried in sand.",49
"740","self","s555","it is about eating fish for pregnant women",30
"741","social","s558","How realistic is it to own a wind turbine.",1
"742","social","s559","becuase it is very healthy",92
"743","self","s561","My wife is recovering from breast cancer.",24
"744","social","s563","This is an environmental compilation article that has information on Environmentalists and Nuclear power, international shipping's future and how to reduce your carbon footprint.",51
"745","social","s567","Affordable reusable alternatives to single use plastic items",55
"746","self","s568","Global warming is an important matter to be taken in our society, also it should be seriously think by all levels of people.",85
"747","social","s570","This article matters to people I know because many of them do not want to be fat.",8
"748","social","s571","Everyone in my family absolutely loves getting produce at the farmer's market. We're all big fans as the quality is amazing and the prices are fairly reasonable compared to big grocery retailers.",20
"749","self","s572","Stretching a dollar on American fast food was achieved by the grandmother of a person who was from a wealthy place in Korea that moved to an area of poverty in California. The grandmother was keen in finding ways to stretch a dollar.",70
"750","social","s574","I think this article is important to people that I know because they are interested in understanding what the government supports especially Federal programs",19
"751","social","s575","I have friends and family that avoid gluten.",66
"752","self","s576","Sleep apnea is on the rise due to an increase in obesity.",106
"753","self","s577","oil and gas giants are being sued by states for climate damage",105
"754","social","s578","This article matters to people I know because there are many thousands of families that have been affected by the wildfires in California, and many have lost homes or even loved ones.",17
"755","social","s581","Nowadays, diseases occurs depend upon the foods.",22
"756","social","s582","Evidence shows that pregnant women and children eating fish may make children smarter",30
"757","self","s583","as always known dog are good friend to human and it`s them common nature.",38
"758","self","s584","Solar power is a great way to curb fossil fuel emissions, so seeing more use is always good.",93
"759","self","s587","In case you were thinking of buying a wind turbine, FYI",1
"760","self","s588","This is relevant to me because I am looking for an electric car.",73
"761","self","s589","a lot of consumer products contribute to air pollution.",107
"762","social","s592","This is old news but good to remember I guess.",84
"763","social","s593","It is all about prevent the climate change.",71
"764","social","s594","The article speaks about the newly constructed areas in flood prone area.",23
"765","self","s595","It is going to enlighten me about how some nutrients are affected by cooking",42
"766","social","s598","This article is about lawmakers, lobbyists and the Administration try to overhaul the Endangered Species act.",89
"767","social","s599","global warming is affect whole world avoid some dangerous.",15
"768","self","s600","Partners need to be more educated on their partner's disorder",96
"769","social","s602","It is about the environmental damage of plastic waste.",67
"770","social","s606","This article about the climate change at arctic talks.",35
"771","self","s608","Exxons's motion to ignore climate investigation was denied",3
"772","social","s610","An article about vegan",26
"773","social","s613","How to be more efficient when buying produce.",20
"774","self","s615","disadvantages of soft drinks",32
"775","self","s616","The climate change is making the problem worse.",13
"776","social","s618","Pollution affects everyone across the globe.",79
"777","self","s619","A.I to Transform Breast Cancer Care",104
"778","self","s620","Potential side effect of statin medications being skin infections",80
"779","self","s621","I am looking to add to my training regimen and this article should help.",58
"780","self","s622","A deadly 2016 glacier collapse in Tibet surpassed scientist",45
"781","social","s623","we should have responsible for keep our wilds from fire free.",63
"782","self","s624","If you exercise you can stay physically younger.",18
"783","social","s626","Article matters to people so that they can make necessary steps to protect our environment.",63
"784","social","s627","Enforces decision to not smoke and exercise instead",16
"785","self","s628","It is moderately important to me.I also search about coal",41
"786","self","s629","Many people are less concerned in environmental issues.",23
"787","self","s630","because it is about helping the children",86
"788","social","s631","Solar power's still interesting, but still mostly useless, definitely impractical. Would be nice if it worked, but that's still a long way away.",93
"789","social","s634","Climate change effects every person that I know.",35
"790","self","s635","Australia has gotten a permit to work in a coal mine.",21
"791","self","s636","If I switch to a plant based diet it may increase my longevity.",64
"792","self","s638","Its good to know how important Vitamin D is  for a baby.",60
"793","social","s639","Climate change may destroy some of the Mediterranean's most important sites.",85
"794","self","s640","This article about the injuries related to driving, work, leisure and sports by poor hearing...",90
