"","cond","SID","value","article_number"
"456","social","s081","It is an awful thing to see and hear about",79
"457","self","s082","This article is about how antioxidants will not cure muscle ache after a workout.",40
"458","social","s083","It matters because it gives me a clue on how to lower my risk to the disease.",82
"459","self","s084","global warming is real and causing more problems every day",15
"460","social","s085","This article would give people I know hope that the next generation is willing to fight against climate change.",27
"461","self","s086","Older cyclists are healthier than other people of their age group due to the amount of exercise.",18
"462","self","s089","Global warming is causing more violent storms, and it might be getting worse.",15
"463","social","s090","Energy giants and conservative groups are fighting Trump's fuel efficiency rules.",29
"464","social","s092","BOKS program can be useful for the parents.",86
"465","self","s093","Scientists are trying to save the last a  porpoises  because they are exctinct",101
"466","self","s095","Recommendations for alternative cleaning products for disposable, one-time use items and their effectiveness",47
"467","social","s097","This is about the plans in Congress to help people buy electric cars",73
"468","social","s099","Is it really surprising that being overweight and cancer can go hand in hand?",54
"469","social","s100","This article matters to people I know because it provides information on building a new home in a flood zone, despite climate change.",23
"470","self","s101","Adding fish to your diet increases intelligence.",30
"471","social","s103","Because they keep producing coal that we continue to use that potentially causes risk in the future.",43
"472","self","s104","This article is about how the use of solar power is increasing but fossil fuels still account for a lot of electricity use.",93
"473","self","s106","The article is about the benefits of extra intensity in exercise.",56
"474","social","s108","How exercise, specifically bicycling is very healthy for people and keeps them youthful.",18
"475","social","s110","vegan may be healthy but he or she need more calcium",26
"476","self","s111","The effects on cholesterol that red meat vs white meat have.",50
"477","self","s112","Romantic partners could prove helpful in aiding their partner with an eating disorder.",96
"478","self","s113","Its about how large companies are facing large amounts of money in climate related risks",87
"479","social","s114","This article is about how climate change is many natural disaster more prevalent, and they could happen at the same time.",99
"480","social","s115","Many of my family members suffer from obesity and diabetes. Getting in shape could be just the thing that brings us together and helps us live longer.",56
"481","social","s116","Tides are killing people and it has to do with toxis. THere needs to be more down for the environment.",39
"482","social","s117","disobedience makes severe action",65
"483","self","s118","Dietary supplements for weight loss, sexual function, and muscle building can have side effects that range from bad to fatal.",10
"484","self","s119","This article does not surprise anyone.",6
"485","social","s120","Take Vit D if pregnant to improve baby's teeth",60
"486","self","s121","A garbage patch in the Ocean may be bigger than originally thought.",79
"487","social","s122","on four continents record heat is having a negative effect",97
"488","social","s123","I think it's a hook for an article on climate change, which would matter to people I know because climate change affects everyone.",5
"489","self","s124","This matters to me because I am always up for healthy drinking.",68
"490","social","s125","Some of my friends have nieces and nephews of this age",44
"491","social","s126","to have  a healthy stuff for long live",26
"492","self","s127","if skier are saved the snow for snow season",5
"493","self","s130","This is about a failed initiative to reduce carbon emissions due to some eastern countries objections.",41
"494","self","s132","Encouraging kids to eat healthy",2
"495","social","s133","Our children will bear the full brunt of our short-sidedness.",91
"496","social","s134","Being overweight can contribute to cancer as shown in certain parts of the U.S. versus other parts where the rate of weight-associated cancer is low.",54
"497","social","s136","This article is about how exercise helps older people to be healthier and biologically younger.",18
"498","social","s137","Many individuals I know personally use CBD oil religiously. despite the claims there is not firm evidence of what the oil actually does.",88
"499","social","s139","Medical benefits are seen after banning sugary drinks.",94
"500","social","s140","Because everyone I know is having some hearing trouble",90
"501","self","s141","Saving money involving children",12
"502","self","s143","American cities recycles foreign garbage.",49
"503","self","s145","This makes me a bit happy because I've cut sugary drinks out of my diet. It helps affirm that decision.",94
"504","self","s146","The article is talking about the immune system and giving information on how effective it is against certain viruses.",100
"505","self","s147","Being physically fit and healthy can have many benefits that can lead to a healthy and long-living life.",16
"506","self","s149","The new study about Great Pacific Garbage Patch's Is Ballooning and counting.",79
"507","social","s150","This could affect my local schools by making children happier and healthier.",86
"508","self","s151","Climate updates are a necessary event in life",11
"509","social","s153","Bananas may be healthier than the sports drinks they are drinking",68
"510","self","s155","This article matters to me because I want to reduce my footprint as much as possible.",67
"511","social","s156","A new trend for runners are challenge (more difficult) races that vary the experience for runners.",62
"512","self","s157","The article about wilder storms.",15
"513","social","s159","DUE TO CHANGE CANCER CAUSING COMPOUNDS IN THE BODY",28
"514","self","s160","This is important because I always to gain strength fast",48
"515","self","s161","THIS ARTICLE AFFECTS ME PERSONALLY BECAUSE OF THE AMAZON FIRE IS THE BIGGEST FIRE ACCIDENT IN THE WORLD SEVERAL ANIMAL WERE DEAD AND SO MANY TREES WERE FIRED THUS AFFECTS ME PERSONALLY",7
"516","social","s163","Dr Blau, a cancer researcher who has cancer, has started a company to crowdsource a new individualized approach to how he handles and treats multiple myeloma.",24
"517","social","s166","This article matters to people I know because while people age, they don't have to worry about giving up their hobbies, exercising, or what they enjoy.",76
"518","self","s167","Deceptive health claims are bad for everyone and they personally disgust me.",88
"519","self","s168","This article matters to me because I am glad to see young people involved in the climate crisis.",109
"520","social","s170","health benefit of using vitamin d",60
"521","self","s172","I think that personally climate change is a huge issue for me and one I hope is addressed in the new presidential administration.",35
"522","social","s177","Many homes are being built in places that are prone to flooding
",23
"523","self","s178","As someone who formerly raised rare and endangered miniature farm animals, this concerns me greatly.",89
"524","self","s184","Needs to bigger roll outs for solar energy because fossil fuels are killing the planet.",93
"525","social","s185","Solid foods for babies may lead to better sleep.",44
"526","self","s186","Paper bags generate more air pollutants than plastic. They generate more water pollutants than plastic.I should avoid them.",57
"527","self","s187","This article matters to me, because this advance in science to help people dealing with obesity could help people I know and love.",74
"528","social","s189","The oil industry continues to have its hands in the pockets of influential politicians.",29
"529","social","s191","it's about new bacteria to make people run faster and it's unclear to work for people",72
"530","self","s192","This matters to me because I don't want to gain excess weight and I want to be healthy.",54
"531","self","s193","Due to some issues the two countries has joined together and have a fight",105
"532","self","s194","I am about to have a child so any tips on how to make my child smarter is helpful.",30
"533","self","s195","Post-exercise muscle aches might not be helped by antioxidants.",40
"534","self","s196","It is about how drinking sugary drinks causes a short life span",32
"535","social","s197","we should aware of how plastics affect the environment , this article may help people to realize the consequences",67
"536","self","s198","This article makes very fearful and anxious, that is relevant to my society.",80
"537","self","s200","Article is about cooking food and its nutrition values.",42
"538","social","s201","There's more doom and gloom about a substance that has been around since ancient times. We'd know more about it if it hadn't been treated like it was worse than the oxycontin they threw at everyone instead.",88
"539","self","s202","Who scared of High-Intensity should take a heart monitor",58
"540","social","s204","Climate meetings and reducing holiday waste.",11
"541","social","s205","Hmm...we may not slow down as much as we thought when we age. That's good news.",76
"542","social","s206","I dont know about the snake oil",88
"543","self","s207","This is an interesting study about the effects of food, our workouts, and how we deal with that throughout the day if we change one simple thing.",0
"544","self","s208","its about plastic and paper both have downsides",57
"545","social","s210","A pilot study on a probiotic that might help with obesity.",74
"546","self","s211","This article is relevant to me personally because it demonstrates how natural foods are still better than man-made alternatives when it comes to recovery. Bananas are a natural replacement for carbohydrates after exercise and help to boost recovery and may do so better than sports drinks which are significantly more expensive",68
"547","self","s212","Obesity paradox fails to holdup",108
"548","social","s214","figure out if food nutrients go up or down after being cooked",42
"549","social","s215","I'm thinking flood insurance will become a thing of the past... MOVE!!!",99
"550","social","s216","It is about the side effects of dietary supplements.",10
"551","self","s217","It's interesting what animals could be extinct in my lifetime.",101
"552","social","s218","meat will increase women breast cancer level",52
"553","self","s219","It matters because I look for ways to help the climate.",1
"554","social","s222","A federal judge in New York called a lawsuit brought by Exxon Mobil against state attorneys general in New York and Massachusetts implausible.",3
"555","self","s223","This matters to me personally as I want to stay updated about technology related news because I work in the IT industry.",81
"556","self","s224","I can help in a Green sense by changing energy provider.",83
"557","social","s227","Oil Industry's covert campaign to rewrite American Car emissions",29
"558","self","s230","The Arctic Council was unable to issue a joint statement on climate change because the U.S. blocked it. Climate change is important to me because I feel we have a lot of bad information from non-scientists who have a vested interest in their views. I want the evidence to broad based and backed up by data. Proper interpretation of climate helps determine where public funding goes. That is reflected in my tax dollars.",35
"559","self","s234","This is about the unknowns surrounding a marijuana extract.",88
"560","social","s235","This is to add to the population of people with the ability to easily handle dangerous procedures",80
"561","social","s236","this article matters because it includes information about how global warming is affecting us and how we are adopting to such changes",15
"562","self","s237","PLASTIC DOES NOT DEGRADE",67
"563","self","s242","It talks about how there could be more climate related disasters happening at the same time in the coming future.",99
"564","self","s243","Greta's journey. See how she got here",65
"565","social","s246","This matters because I know several people who own SUVs.",103
"566","self","s248","Our climate scientists should analyze the things behind natural disasters. If they properly do this thing, definitely they will find proper reason for climate change or global warming.",11
"567","social","s249","romantic partner don't know how to help their partner with a eating disorder",96
"568","self","s250","This article is about Running and runners.",62
"569","social","s251","This article is about US climate report that warns of damaged environment and a shrinking economy. The US would lose 10% of GDP by 2100.",9
"570","social","s255","The pro and cons to choosing either paper or plastic bags at the grocery store.",57
"571","social","s257","its about antioxidants don't ease muscle soreness after exercise",40
"572","self","s258","During holidays lots of food will waste and there are so many people do have food eat so share with them.",11
"573","social","s259","It explains the difficulties of hearing loss it is very useful news.",90
"574","self","s260","Trying to figure out rising sea waters can earn companies a lot of money/",59
"575","social","s261","We all need to find time to workout - this might help!",48
"576","self","s262","Climate change is real and we should all be paying attention to it right now.",59
"577","social","s265","The nature of the foods you eat may be more critical to weight loss than how much you eat or the amount of calories you consume.",8
"578","self","s268","The article tells that the recycling is not really being done that China really stopped using foreign garbage",49
"579","social","s270","This article shows the benefits of exercising",56
"580","self","s273","i think breakfast is super important so this article would interest me.",0
"581","social","s274","Because this is very useful for people",8
"582","social","s275","I know some people that live in these 'at risk' places.",59
"583","self","s276","It was about the exercise was giving a healthy muscles and great immune systems.",18
"584","self","s277","climate changes causes various natural disasters",99
"585","self","s278","I am trying to reduce my environmental waste and plastic use. This kit looks like it would be perfect!",55
"586","social","s279","This article matters to people to understand the cardiovascular fitness were less likely to develop dementia.",34
"587","self","s280","Using a heart monitor can make high intensity training better.",58
"588","self","s281","Exxons case on climate investigation is not going to go forward because the court has declared the suit to be implausible.",3
"589","social","s283","energy gisnts support Trumps roll back of fuel efficiency rules",29
"590","self","s287","It matters to me because it makes me hopeful that if I exercise I can ward off dementia.",34
"591","self","s288","Risk of flooding from global warming does not deter home-builders at all.",23
"592","social","s292","We may be able to cut down on exercise to help us lose weight.",78
"593","social","s294","the people I know believe that using electric car will reduce change in the climate",73
"594","social","s295","Because most of the people I know use deodorant",107
"595","self","s297","Young people around the world are protesting about climate change.",27
"596","social","s299","People can take action to preserve our planet and inspire change!",27
"597","social","s300","read about how to improvise your usage of plastics",55
"598","self","s301","Bananas replacing sports drinks.",68
"599","social","s303","research has raised concerns like sports activities",98
"600","self","s305","I live in a city that has flooded a lot recently, so I am worried about how heat waves will impact me",91
"601","social","s307","that is enlightening",0
"602","self","s308","It is about meat consumption and cholesterol level.",50
"603","self","s311","This article is about what to eat and drink to prevent kidney stones.",46
"604","self","s313","The unknown aspects of CBD.",88
"605","self","s314","A physician specializing in cancer research and who has cancer himself has founded a company to bring individualized treatment to cancer patients.",24
"606","social","s316","The article is about the floating garbage field in the pacific ocean and how it is much larger and faster growing than thought.",79
"607","self","s318","A study found that people who oppose GMOs know less about them than others.",102
"608","self","s319","Health tip is very important",78
"609","self","s320","I was affected in 2016 and it was very bad",45
"610","self","s321","This article is about heart disease",82
"611","social","s322","This article is relevant to most of the women in my life.  My mother has had breast cancer and anything that teaches them of ways to mitigate the risks is helpful.",52
"612","self","s324","It does not apply to me because I believe climate change is made up for political agendas from the left.",73
"613","social","s326","Child's play is always welcome. This article is about sedentary children and the responsibility of the United States if they exercise everyday then they can save billion dollars",12
"614","social","s327","health food for to prevent kidney stones ill",46
"615","social","s328","I know that me and a lot of others like using straws and water bottles",55
"616","social","s329","This article is about Wind Turbines, drones and the need for America to change it's attitude towards climate.",1
"617","self","s330","I do think eating deli meat really is unhealthy, from my own experience. My friend used to eat it all the time and he died from correctional cancer. There really could be a connection.",28
"618","self","s331","maintain proper diet ant is the slow process.",78
"619","social","s335","Making know to the people the amount that was released for the purchase of American-made elecric and hybrid cars and trucks",73
"620","self","s337","Coal power is one of the largest and most polluting energy sources available. The air circulates around the world, so increasing supply may decrease prices and ramp up demand, and pollute the air I breathe. It would also worsen conditions I experience with climate change.",21
"621","social","s338","They care about their own health and quite a few of them are at ages where cancer diagnosis can be very relevant to them.",104
"622","social","s344","This is to inspire everyone out there. It is important to always try something new even if it means leaving your comfort zone.",62
"623","self","s345","I think we really need to get our kids moving around in order for them to lead happy and healthy lives.",86
"624","social","s348","I agree. One need to monitor what the kids eat",92
"625","social","s349","The complicated relationship between nuclear power and the environment.",51
"626","social","s352","The article matters to people I know because it help to reduce the risk of cancer by reduction of weight",54
"627","social","s353","This article is about climate change and the elections.",75
"628","self","s358","This article about wind turbine was good",1
"629","self","s360","Staying home is also a better option and which is helpful spend time with the family people. Also it causes a better environment and for the pollution.",33
"630","social","s361","I have a dear friend who lives in Louisiana, which is very flood prone, and information regarding floods always makes me think of him.",25
"631","social","s363","It matters to people I know, because they care about this planet and want a better world for their kids.
Article is about consequences of climate changes right now.",7
"632","social","s364","Using robots to teach the new era of caring for cancer.",104
"633","self","s368","I feel knowing more about current climate challenges is really important.",3
"634","self","s371","I would probably pay less in taxes toward healthcare if more children became more active than they are presently.",12
"635","social","s372","Friends of mine are watchful over breastfeeding and general feeding of their newborns. This explains why my sister also breastfed her children because it is healthier for them.",44
"636","self","s373","There are other key reason to lose weight.",6
"637","self","s375","It's about the well documented and well known Plastic waste that ends up in our Oceans. The Ocean currents and wind drive them to a certain area where they accumulate and impact so much of the Ocean's wildlife and also end up on some beaches.",79
"638","social","s380","I know people in live near flood zones.",23
"639","social","s386","certain states are suing the oil and gas giants",105
"640","self","s387","the person you are dating want to help with your eating disorder",96
"641","social","s390","global warming is bringing an era of wilder",15
"642","self","s394","best of supplement in my life",10
"643","social","s395","The BOKS program and Before-school exercise program and also for a children's concern",86
"644","social","s396","Climate change facing problems.",99
"645","social","s399","Automakers seem to have a shift in their thinking about climate change.",71
"646","social","s400","It helps people to live a positive natural life.",83
"647","self","s401","The climate changes seems to be the major problem right now, due to this the chain will gets break and goes on out of control",35
"648","self","s402","This would be better one to follow",31
"649","social","s403","the vaquita are near extinction",101
"650","social","s406","People I know care about our environment and safety and want to know about the future effects climate change will have.",59
"651","self","s411","weight loss is neccessary one most of the people works on simply sitting work so they had a over weight so they control their food and diet cut back on added sugar grains without worrying about calories",8
"652","self","s412","obesity was high risk .climp amoung americans adults",106
"653","self","s414","I enjoy reading about Ancient Egypt and how they handled things.",37
"654","self","s415","unknown details about wildfires !!!",63
"655","self","s418","This article matters to me personally because I want to live a long healthy life.",108
"656","self","s419","I think it's important for people who are going through things to have a great support system.",96
"657","social","s420","Based on this study hard work exercise will build a strength with in 13 minutes and it's really useful to work on.",48
"658","self","s421","Being too sedentary is not good for children and it would be best for their health if they were more active, it could even save up to $120 billion a year.",12
"659","self","s422","If that's the case, will there be more landfills popping up around me?",49
"660","social","s423","Climate change is making wildfires worse.",7
"661","self","s425","This article stresses the importance of fitness and a long life.",16
"662","self","s432","This article is about a bacteria supplement made from a bacteria found in the gut that helped mice run faster.",72
"663","self","s434","Trump is involve this matter",29
"664","social","s435","It is an interesting approach and perhaps some people I known will take this piece of information to improve their physical condition.",72
"665","social","s436","She have a well experienced about price differentials between Asian, Hispanic, and white markets.",70
"666","self","s437","unity is best policy i think so",105
"667","self","s439","The sad story of a near endangered animal that was not able to be rescued, despite a valiant effort by a team of scientists.",101
"668","social","s442","we do not build strength in 13 minutes. it is impossible in 13 minutes. we have to put a hard work month or year.",48
"669","self","s444","This article matters to me personally because it helps me to know one of the cause of colorectal cancer",28
"670","self","s445","funds can be recover soon",13
"671","self","s446","I go grocery shopping so this might have some tips for me.",57
"672","social","s448","It indicates something about the society we live in, and the effect it has on us. People like me are better prepared to live a meaningful life if we have more awareness of how our society and culture effect our behavior.",36
"673","self","s449","This article describes about the climate week.",83
"674","self","s450","This article is very removed from me, but I guess it affects the overall global environment.",21
"675","social","s453","this article is about scaring intensity",58
"676","social","s454","Wind turbines does nothing for my state except noise pollution. We have them but do not effect our environment.",1
"677","self","s456","During the weight loss exercise eat minimum amount of food",78
"678","self","s457","This article is about how wildlife in Florida is being killed off because of a toxic tide.",39
"679","social","s460","This article is about a lawsuit that Exxon filed to try to block an investigation into their climate policies.",3
"680","social","s462","It's everyone's job to help preserve wildlife, so please give this a read if you have time.",101
"681","social","s463","this would give people an idea about pollution created by these bags",57
"682","social","s466","If people understand causes of these fires, they can help.",17
"683","social","s467","scientifically it will work. take some test for humans and find it will work for humans or not.",72
"684","social","s470","every has kidneys and they should know about them",46
"685","self","s471","Everyone needs cleaning products and we all want the ones that work the best and are cost effective. This article would help explain which way to go with 5 examples.",47
