"","cond","SID","value","article_number"
"1","self","s001","A shrinking GDP and economy would be bad for me because it means there will be fewer economic opportunities for me in the future.",9
"2","self","s002","Its good to consume more vitamin D to help child's bone and teeth",60
"3","social","s003","Because people I know live in poverty and can probably relate.",70
"4","social","s004","Wildfires are going to become more common as climate change continues unabated, so lets learn something about how to protects ourselves better against the risks of fire.",17
"5","social","s005","Green energy is better for the environment and Earth health. Something to consider.",83
"6","social","s008","I care about my family and want to keep them aware.",80
"7","self","s009","I am a young person who is concerned with environment impact of human actions on earth and my future generations.",67
"8","social","s010","The article tells you how switching to a green energy provider can help with climate change",83
"9","social","s012","if we want clean air, we should stop using less deodorant and other perfumes.",107
"10","self","s014","I am always interested in dietary information and health.",4
"11","social","s015","This should worry you a lot as it is a sign of climate change that might be un-reversible and will effect our children and grandchildren.",45
"12","social","s017","Climate change is likely to put various big companies at financial risks.",87
"13","social","s018","I know some people whose kids are chubby and this article may help them to develop better eating habits for their children.",92
"14","self","s019","The article is about the heatwave that hit Europe. Also, It says that the USA could face the same challenge.",91
"15","self","s020","Some people advocate to use green energy.",83
"16","self","s021","This article matters to me because coal poses a risk to my health.",43
"17","social","s024","Most of my friends and family live somewhere near the Mississippi River, a few have been affected by floods.",25
"18","social","s025","This article matters to people I know because if this rare vaquita porpoise becomes extinct, then this species vanishes off the face of the Earth forever and that has downstream consequences to other species.",101
"19","social","s028","It is related to the people i know who were living in the climatic site",105
"20","self","s030","It is always important to use the resource that we have possible as much as possible and so it matters me personally.",83
"21","social","s031","Improving the strength.",48
"22","self","s032","This article explains the importance of following a certain diet for vegans.",26
"23","self","s036","I think it would be nice if more people had healthy relationships.",96
"24","social","s037","about the oil industry technology",88
"25","social","s038","The gluten-free diet has had a minority of objections to consider what possible issues it might bring.",66
"26","self","s040","it is related to me because my invasive grasses.",63
"27","social","s041","This article is providing information on how people are reluctant to buy disaster insurance even though the climate changes had gotten worse by year.",53
"28","social","s042","the administration is sitting on tens of billions of dollars in unspent recovery money meant to help Americans recover from disasters, leaving people less able to rebound from the effects.",13
"29","self","s043","Children need to get out and play. It is important to combat childhood obesity.",12
"30","social","s045","because people are always trying to lose weight and they cant figure out why it doesnt happen or work out for them",78
"31","self","s046","the weight which increases it may cause of getting cancer in our body affects personally",54
"32","self","s048","EU leaders could not reach the climate target goal due to eastern countries objections.",41
"33","social","s049","People I know care about climate change a lot.",97
"34","self","s051","The article shows that we eat more when we exercise more and how it affects weight loss.",78
"35","self","s052","This article matters to me personally because it is spreading fear and non-science thoughts on climate change which are not factually based.",7
"36","social","s053","If your partner has an eating disorder and you want to help, this article might show you how.",96
"37","self","s054","This is not proofed yet. Paints a picture of snake-oil sales, hyped-up claims and minuscule science",88
"38","social","s055","This article could potentially warn people I know with hearing loss of the dangers they could face.",90
"39","self","s056","Sleep apnea is a rising concern due to the obesity epidemic.",106
"40","self","s057","We need to conserve our resources before they are gone and we can never get them back.  This also includes endangered animal species.",31
"41","self","s058","Climate change is an issue that will affect all of us, and we need to do something about it.",27
"42","social","s062","This matters to all the females I know because it would educate them on food health and its effect on breast cancer. This is something that all female should know so they know they aren't unknowingly putting themselves at a higher risk.",52
"43","self","s063","An article on how processed meat gives you cancer.",28
"44","self","s064","the pharoahs tried in vain to stave off the effects of potential drought",37
"45","social","s065","This article matters to people I know because plastic and trash in the ocean is a major concern for them and myself.",79
"46","social","s066","Trying to eat before a workout makes you feel gross, its better to skip it.",0
"47","self","s067","It's quite relevant to the work that I have done for the last 6 years of my life.",86
"48","social","s068","Things that were presented during a conference.",81
"49","self","s069","So much wildlife is becoming endangered and it is sad to me that we are contributing to their deaths.",101
"50","self","s070","This is true. Most people think it is some magical creation like the Wizard of Oz but it isn't.",102
"51","social","s072","This article matters to people I know because they are against climate change.",27
"52","social","s073","This matters to people I know because they try to recycle and who want to know what happens to recycling.",49
"53","social","s074","Being able to prevent breast cancer would be a huge win to everyone",104
"54","social","s075","climate change reflects nature",95
"55","self","s076","it makes me sad that we are not taking care of the people in need in our country even though we have the funds available to do so",13
"56","social","s078","The government will be giving people free money to go out and buy eco-friendly cars.",73
"57","social","s079","a wonderful innovation on using AI to prevent cancer",104
"58","self","s080","Taking antioxidants after working out isn't proven to help muscle soreness.",40
"59","social","s081","It might be helpful in losing weight",74
"60","self","s082","This article is about how some food's nutrients go up when they are cooked while other food's nutrients go down when cooked.",42
"61","social","s083","It gives me a look at how people are trying to help solve climate change.",81
"62","self","s084","being fit may be better for you then being a non smoker.",16
"63","social","s085","This about how to stay safe during natural disasters.",25
"64","self","s086","Disaster recovery funds are not being expedited.",13
"65","self","s089","The senate passed a bill that will help protect certain parts of the environment.",19
"66","social","s090","I have a family member who has a home in a flood zone.",23
"67","social","s092","Skin infections are related to statins.",80
"68","self","s093","Cardiovascular disease and obesity are closely related.",108
"69","self","s095","I would like to see the world start tackling climate change, so it's important to know what industries or individuals are fighting against that (and profiting from it).",43
"70","social","s097","I know there are some genetic features involved in weight gain and this might explain why some of us can't lose or gain weight.",78
"71","social","s099","How can there even be a contest at this point?  paper bags are obviously better for the environment which in turn is better for us all",57
"72","social","s100","This article matters to people I know because it explains the Victory for Coal (beneficial to climate change).",21
"73","self","s101","As a practicing minimalist, consuming less is at the crux of my day!",31
"74","social","s103","Cooking boost nutrients in tomatoes and spinach but could lower others.",42
"75","self","s104","This article is about the correlation between banning sugary drinks and people's health.",94
"76","self","s106","This article is about a start-up that is trying to predict environmental climate risks in the future for profit.",59
"77","social","s108","It's about Senate completing a bill that conserves a huge swath of the wilderness for environmental safety.",19
"78","social","s110","Farmer only fixed the rate for food...",20
"79","self","s111","Eating processed meats and the effects it has on breast cancer risk.",52
"80","self","s112","Hearing loss can negatively affect people in their everyday life.",90
"81","self","s113","Its about informing people that different factors such as diet could remove plaques in your arteries and could decrease possibility of heart attacks.",84
"82","social","s114","This article is about whether parents are responsible for overweight kids.",92
"83","social","s115","How to help the environment by reducing my single use plastic habits.",55
"84","social","s116","EAtting fish is good for your health. There hs been moe outlined about ti. It what people want to her to help them in the long run.",30
"85","social","s117","grow green save environment",67
"86","self","s118","If it isn't obvious yet, being in good shape is called ""good"" for a reason.",16
"87","self","s119","This article contains many reasons to not buy a wind turbine, I only need one.",1
"88","social","s120","grasses may be the cause of or worsen wildfires",63
"89","self","s121","Aging may not be as severe as people think.",76
"90","social","s122","It says low impact sports may put your bones at risk",98
"91","social","s123","This article is about the effect of climate change on exotic locales and wildfires.",7
"92","self","s124","This article matters to me because I've never been good with gluten free diets.",66
"93","social","s125","My parents recycle regularly.",49
"94","social","s126","eating the deli meat will increase the risk of cancer by colorectal",28
"95","self","s127","a globe change our climate and people are scared",7
"96","self","s130","This article is about avalanches caused by global warming in Tibet.",45
"97","self","s132","I want to lose weight so it's interesting",0
"98","social","s133","Who would have thought not hearing dangers would increase accident risks.",90
"99","social","s134","This is about how to incorporate a heart monitor into your high-intensity interval training so it is less daunting and more enjoyable.",58
"100","social","s136","This article matters to people I know because climate change affects everyone and they can benefit from tips on reducing waste to help in the efforts.",11
"101","social","s137","Climate week allows for activist and world leader emphasized the need of going green.",83
"102","social","s139","There are campaign ads that are focusing on global warming.",95
"103","social","s140","Because childhood obesity is on the rise and I know people with kids",92
"104","self","s141","Loads of people displaced because of a hurricane.",13
"105","self","s143","Australia helps for burning coal in future.",43
"106","self","s145","It makes me anxious for the future of humanity as global weather patterns change due to Global Warming.",91
"107","self","s146","The article is attempting to shed new light on G.M.O.s in order to combat certain assumptions on them.",102
"108","self","s147","It matters to me because I am getting older and it is best the start early to maintain our bodily functions than to be too late.",14
"109","self","s149","Obesity is the big problem of teenagers nowadays.",74
"110","social","s150","It's about how heart and blood-related problems are tied to an increased chance of developing Parkinson's Disease.",82
"111","self","s151","Everyone should try and work on natural forms of weight loss, etc instead of depending on supplements",10
"112","social","s153","The article is about recycling and 6 things you may not be recycling correctly",69
"113","self","s155","Bananas might be better than sports drinks.",68
"114","social","s156","This article is about Greta, the climate activist, and how she got where she  is today.",65
"115","self","s157","The article about child's play is good for all of Us.",12
"116","social","s159","MELTING SNOW AND ICE",25
"117","self","s160","This is important because I always want the most effective way of cleaning products without wasting too much materials",47
"118","self","s161","EXERCISE ALONE IS NOT A WAY  TO WEIGHT LOSS BECAUSE IT GIVES A LONELINESS FEEL SO EXERCISE WITH A PARTNER IS A BEST WAY TO WEIGHT LOSS AND ENJOYING THE WORKOUTS",6
"119","social","s163","If you eat plants with high counts of flavonoids you have a lower risk for cancer and cardiovascular death.",22
"120","social","s166","The article is about a person visiting McDonald's with their grandmother in both Korea and United States and how the grandmother could afford fast food in both cultures.",70
"121","self","s167","Lawmakers and lobbyist are attempting to weaken protections for endangered species.",89
"122","self","s168","This article is about an endangered porpoise.",101
"123","social","s170","this will be an attention for my fellow people about their diet",66
"124","self","s172","I know that I personally walk pretty fast, I have never thought about how I walk around other people though.",36
"125","social","s177","People I know will be affected by climate change",25
"126","self","s178","This explains some of the risk factors that contribute to developing Parkinson's disease.",82
"127","self","s184","The banning of sugary drinks was related to improvements in health at the University of California, San Francisco.",94
"128","social","s185","This article matters to the people I know who exercise because they are always complaining of sore muscles.",40
"129","self","s186","Climate change can contribute to the intensity of heat waves by increasing the chances of very hot days and nights.",53
"130","self","s187","This article matters to me because I care about protecting the environment and I want to know how these things were voted on and by who.",75
"131","social","s189","Many people are still building homes in flood zones despite warnings.",23
"132","social","s191","Peoples are affected with metabolic disorders",74
"133","self","s192","A Silicon Valley company is trying to find out what sections of land may be underwater in the near future, which is a difficult task but with financial potential.",59
"134","self","s193","Recent days most mammals can died so we should save it for rehabilitation.",101
"135","self","s194","A study shows that people who exercise more are less likely to develop dementia.",34
"136","self","s195","I might want to have healthy organs in my future.",46
"137","self","s196","It is about how a tide is destroying the Florida Wildlife.",39
"138","social","s197","plants protein  will reduce the cardiovascular death is a good news, i will pass this information",64
"139","self","s198","This article make feel fearful and worried.",85
"140","self","s200","Article is about Solid food for babies",44
"141","social","s201","you would think they would do more to lobby for politicians who support climate action.",87
"142","self","s202","People should take care of their weight",54
"143","social","s204","Recovery funds aren't being properly utilized for recent national disasters.",13
"144","social","s205","87,000 TONS of plastic floating between California and Hawaii, and growing exponentially??! That's horrible.",79
"145","social","s206","Everyone should take care of it above disease",82
"146","self","s207","I do not want to spend another summer indoors because the smoke is so bad. This is in our backyards already and it's happening in other places that it shouldn't.",7
"147","self","s208","womens dicrease level of meat eating",52
"148","social","s210","What the people had to say about climate change during the elections.",75
"149","self","s211","The article is about Greta Thunberg, a Swedish girl who became a global symbol for climate action. It details the path she took and how her act of civil disobedience propelled her to fame",65
"150","self","s212","30 vaquita porpoises",101
"151","social","s214","read this to see what you can do to prevent kidney stones",46
"152","social","s215","Healthy lifestyles start early!",92
"153","social","s216","How exercise is good for children.",12
"154","self","s217","It looks like A.I. can help with treatment of cancer.",104
"155","social","s218","It was about different type of meat cholesterol level",50
"156","self","s219","It is about climate change increasing the dangers of wildfires",7
"157","social","s222","My Bariatric Solutions is owned and operated by Wise Health System. The East Campus of Wise Health System has undergone an independent, voluntary, and peer evaluation in accordance with nationally recognized bariatric surgical standards and has been accredited for bariatric surgery",0
"158","self","s223","This article is about calling into question the validity of CBD and whether or not is effective and has health benefits.",88
"159","self","s224","If you take statins, beware of risk of staph skin infections.",80
"160","social","s227","learning about flavonoids and its uses creates positivity",22
"161","self","s230","Who we are culturally determines how we walk and with who. As for myself, I walk at a slower pace and tend to walk about the same speed as my wife. I have been with others that walk much faster than I do. I don't change my speed for them though.",36
"162","self","s234","I'm always looking for reasons to be hopeful about climate change.",81
"163","social","s235","Tirumala says that in five years we will have enough to engage in this kind of recipe",87
"164","social","s236","This article matters because it includes information about longevity",16
"165","self","s237","BANANA REPLACE SPORTS DRINKS",68
"166","self","s242","How workers at a university saw improvement in their  health after a ban on sugary drinks was put into effect.",94
"167","self","s243","Not aa runner myself but this seems applicable to any fitness endeavor",62
"168","social","s246","This matters because we all will be affected by climate change, whether directly or indirectly and my family includes youth who are interested in climate change.",109
"169","self","s248","This article also claims global warming. It explains the impacts of The Kincade fire in California. Our government should takes step to control this fire",17
"170","social","s249","ads about climate change are being put on the agenda",95
"171","self","s250","This article matters to me personally because I am responsible for my town to clean the environment.",67
"172","social","s251","This matters to my family because all my brothers and sisters have children of their own and we want them to eat healthily.",2
"173","social","s255","I actually preach this stuff already to the people I know, so this would just be further ammunition for me to load into my truth gun. It matters because every little step helps.",55
"174","social","s257","because we have to know about the coal and climate change",41
"175","self","s258","Land conservation bill will affect the environment and it is not good for people.",19
"176","social","s259","It explains the danger of climate changes in the four continents.",97
"177","self","s260","I have high cholesterol and knowing this makes me want to change my diet.",50
"178","social","s261","Avalanches getting stronger",45
"179","self","s262","It's always good to be lighter in weight or average than to carry high body fat around.",54
"180","social","s265","Losing weight is a combination of things, not just exercise.",6
"181","self","s268","Tells me how I can stay healthier by using less sodium and more calcium rich foods to avoid kidney stones.",46
"182","social","s270","White or red both have some toxic within it",50
"183","self","s273","wildfires will harm many people and that makes me worried for others.",7
"184","social","s274","It is very useful for peoples",1
"185","social","s275","Some environmentalists think that Nuclear Power is good?",51
"186","self","s276","It was about the climate changes was affecting the america and the government was vulnerable the free aids.",13
"187","self","s277","haet wave nudged earth to its hottest month ever.",91
"188","self","s278","Very interesting article! I have been trying to maintain a healthy lifestyle lately with regular exercise. Studies like this provide me with the motivation to continue!",56
"189","social","s279","This article matters to people to understand the early effort to ward off climate disaster.",37
"190","self","s280","Its about being overweight causing cancer.",54
"191","self","s281","I would be so curious about this article that I would want to read it.  It has certainly peaked my curiosity!",5
"192","social","s283","people i know ,icht purchase homes in these flood prone areas",23
"193","self","s287","This article is about helping the earth consume less and a Democratic plan to address the issue of the climate changing.",31
"194","self","s288","A victory for coal is a defeat for all breathing mammals who inhabit this planet.",21
"195","social","s292","We might get financial help to purchase electric and hybrid vehicles if Democratic climate change proposal passes.",73
"196","social","s294","American fast food makes some people i Know crazy with the kind of interest they have in it",70
"197","social","s295","Because many of the people I know live in these areas",105
"198","self","s297","Australia will be able to mine for coal.",21
"199","social","s299","It's important to know nutritional and health information in order to safeguard our bodies from illnesses and cancer.",22
"200","social","s300","people are prepared against future natural disaster",53
"201","self","s301","The downsides of a gluten free diet.",66
"202","social","s303","Our world could face many disasters",99
"203","self","s305","I want to be a parent one day so this might be something to know",92
"204","social","s307","that pretty awesome",5
"205","self","s308","It is about usage of single-use plastics.",55
"206","self","s311","This article matters to me personally because I'd like to build strength in my arms. It'd be great to be able to work only 13 minutes a day to get results.",48
"207","self","s313","I like to learn about the scams of Big Pharma.",80
"208","self","s314","Consuming processed meat such as deli meat has been found to increase the chance of contracting colorectal cancer even in small amounts.",28
"209","social","s316","The article is about the misperception that we must slow significantly as we age.",76
"210","self","s318","A.I. is being used to help predict, treat, and possibly prevent breast cancer.",104
"211","self","s319","This is about the climate change and it is very useful",71
"212","self","s320","This is about babies food and sleep",44
"213","self","s321","This article is about company related risks",87
"214","social","s322","This is relevant to people I know who live in areas of the country where floods are likely, especially as climate change ramps up.  This could help protect them against potential financial devastation if they were to lose their homes to a flood.",53
"215","self","s324","Many people don't lose weight when they exercise because they also eat more.",78
"216","social","s326","Exercise can refresh our mind and body. This article describes about the Exercise will aging Muscles and Immune systems young and they gave older cyclists has their live example",18
"217","social","s327","person's weight control",48
"218","social","s328","This is about how people are not buying insurance even though floods are more likely in certain areas.",53
"219","social","s329","This article is about eating Quality foods for weight loss.",8
"220","self","s330","Why coal? It's the year 2020 and I don't understand why some people don't want to move on to something more environmentally safe. I guess the conservatives everywhere, even in Australia don't care about our planet.",21
"221","self","s331","We should reduce the emission of carbon dioxide.",75
"222","social","s335","This is to make known that various climatic conditions also affects the production of activities such as automobile activity",71
"223","self","s337","The article explains how a vegan diet is not compatible with the disease of gout. It suggests that the solution is giving up some healthy foods the author loves.",26
"224","social","s338","They at the very least purchase GMOs so they could find it useful to know more about them/the people that oppose them.",102
"225","social","s344","It is important to pay attention to your nutritional needs in order to stay healthy. Not all can have Gluton-free diets.",66
"226","self","s345","This shows people how heart issues and diseases could cause them to have Parkinson's.",82
"227","social","s348","We all need to cut down on those sugary liquid",94
"228","social","s349","Heavier people are more at risk for cancer",54
"229","social","s352","This article matters to people I know because it will make them to knw more about climate change",53
"230","social","s353","This article is about climatic change for polar bears.",77
"231","self","s358","It made a big impact on my health",8
